<?xml version="1.0" encoding="UTF-8"?>
<!--

    SPDX-FileCopyrightText: 2001 FAO-UN and others <geonetwork@osgeo.org>
    SPDX-License-Identifier: GPL-2.0-or-later

-->

<schema xmlns:xsi="http://www.w3.org/2001/XMLSchema-instance"
        xmlns="http://geonetwork-opensource.org/schemas/schema-ident"
        xsi:schemaLocation="http://geonetwork-opensource.org/schemas/schema-ident http://geonetwork-opensource.org/schemas/schema-ident/schema-ident.xsd">
  <name>iso19139.nl.geografie.2.0.0</name>
  <id>6b76bf55-da03-4b86-acaa-a81bd982e07a</id>
  <version>2.1.0</version>
  <appMinorVersionSupported>4.4.0</appMinorVersionSupported>
  <title xml:lang="en">Dutch metadata profile on ISO 19115 for geography version 2.1.0</title>
  <title xml:lang="nl">Nederlands metadata profiel op ISO 19115 voor geografie versie 2.1.0</title>
  <description>Geonovum ontwikkelt en beheert het Nederlandse metadata profiel voor het beschrijven van geografische datasets. Dit profiel is een verbijzondering van de internationale metadatastandaarden van ISO en is bedoeld om de interoperabiliteit binnen Nederland te bevorderen.</description>
  <standardUrl>https://docs.geostandaarden.nl/md/mdprofiel-iso19115</standardUrl>
  <schemaLocation>http://www.isotc211.org/2005/gmd http://schemas.opengis.net/iso/19139/20060504/gmd/gmd.xsd
                  http://www.isotc211.org/2005/gmx http://schemas.opengis.net/iso/19139/20060504/gmx/gmx.xsd</schemaLocation>
  <autodetect xmlns:gmd="http://www.isotc211.org/2005/gmd"
              xmlns:gco="http://www.isotc211.org/2005/gco">

    <elements>
      <gmd:metadataStandardName>
        <gco:CharacterString>ISO 19115</gco:CharacterString>
      </gmd:metadataStandardName>
      <gmd:metadataStandardVersion>
        <gco:CharacterString>Nederlands metadata profiel op ISO 19115 voor geografie 2.1.0|Nederlands metadata profiel op ISO 19115 voor geografie 2.0|Nederlandse metadata profiel op ISO 19115 voor geografie 2.0|Nederlands metadata profiel op ISO 19115 voor geografie 2.1|Nederlandse metadata profiel op ISO 19115 voor geografie 2.1|Nederlandse metadata profiel op ISO 19115 voor geografie 2.1.0|Nederlands metadata profiel op ISO 19115 voor geografie 2.0.0</gco:CharacterString>
      </gmd:metadataStandardVersion>
    </elements>

  </autodetect>
  <filters xmlns:gco="http://www.isotc211.org/2005/gco">
    <filter xpath="*//*[@gco:nilReason='withheld']"
            ifNotOperation="editing">
      <keepMarkedElement gco:nilReason="withheld"/>
    </filter>
    <filter
      xpath="*//gmd:onLine[*/gmd:protocol/gco:CharacterString = 'WWW:DOWNLOAD-1.0-http--download']"
      ifNotOperation="download"/>
    <filter xpath="*//gmd:onLine[starts-with(*/gmd:protocol/gco:CharacterString, 'OGC:WMS')]"
            ifNotOperation="dynamic"/>
  </filters>
  <formatters>
    <formatter name="xml" title="" officialProfileName="http://geonetwork.net/def/profile/raw-xml" contentType="application/xml"/>
    <formatter name="dcat-ap-nl-3" title="" officialProfileName="http://geonetwork.net/def/profile/dcat-ap-nl-3" contentType="application/rdf+xml"/>
    <formatter name="jsonld" title="" officialProfileName="http://geonetwork.net/def/profile/jsonld" contentType="application/json"/>
    <formatter name="iso19139" title="" officialProfileName="http://geonetwork.net/def/profile/iso19139" contentType="application/xml"/>
    <formatter name="iso19115-3.2018" title="" officialProfileName="http://geonetwork.net/def/profile/iso19115-3.2018" contentType="application/xml"/>
  </formatters>
</schema>
