<?xml version="1.0" encoding="UTF-8"?>
<!--

    SPDX-FileCopyrightText: 2001 FAO-UN and others <geonetwork@osgeo.org>
    SPDX-License-Identifier: GPL-2.0-or-later

-->

<schema xmlns:xsi="http://www.w3.org/2001/XMLSchema-instance"
        xmlns="http://geonetwork-opensource.org/schemas/schema-ident"
        xsi:schemaLocation="http://geonetwork-opensource.org/schemas/schema-ident http://geonetwork-opensource.org/schemas/schema-ident/schema-ident.xsd">
  <name>iso19139.nl.services.2.0.0</name>
  <id>fd0615d2-ff7f-43ad-908e-f9ed774a34e5</id>
  <version>2.1.0</version>
  <appMinorVersionSupported>4.4.0</appMinorVersionSupported>
  <title xml:lang="en">Dutch metadata profile on ISO 19119 for services version 2.1.0</title>
  <title xml:lang="nl">Nederlands metadata profiel op ISO 19119 voor services versie 2.1.0</title>
  <description>Geonovum ontwikkelt en beheert het Nederlandse metadata profiel voor het beschrijven van services waarin geografische datasets ontsloten worden. Dit profiel is een verbijzondering van de internationale metadatastandaarden van ISO en is bedoeld om de interoperabiliteit binnen Nederland te bevorderen.</description>
  <standardUrl>https://docs.geostandaarden.nl/md/mdprofiel-iso19119</standardUrl>
  <depends>iso19139</depends>
  <schemaLocation>http://www.isotc211.org/2005/gmd http://schemas.opengis.net/csw/2.0.2/profiles/apiso/1.0.0/apiso.xsd</schemaLocation>
  <autodetect xmlns:gmd="http://www.isotc211.org/2005/gmd"
              xmlns:gco="http://www.isotc211.org/2005/gco">


    <elements>
      <gmd:metadataStandardName>
        <gco:CharacterString>ISO 19119</gco:CharacterString>
      </gmd:metadataStandardName>
      <gmd:metadataStandardVersion>
        <gco:CharacterString>Nederlands metadata profiel op ISO 19119 voor services 2.1.0|Nederlandse metadata profiel op ISO 19119 voor services 2.1.0|Nederlands metadata profiel op ISO 19119 voor services 2.0|Nederlandse metadata profiel op ISO 19119 voor services 2.0</gco:CharacterString>
      </gmd:metadataStandardVersion>
    </elements>

  </autodetect>
  <filters xmlns:gco="http://www.isotc211.org/2005/gco">
    <filter xpath="*//*[@gco:nilReason='withheld']"
            ifNotOperation="editing">
      <keepMarkedElement gco:nilReason="withheld"/>
    </filter>
    <filter
      xpath="*//gmd:onLine[*/gmd:protocol/gco:CharacterString = 'download']"
      ifNotOperation="download"/>
    <filter xpath="*//gmd:onLine[starts-with(*/gmd:protocol/gco:CharacterString, 'OGC:WMS')]"
            ifNotOperation="dynamic"/>
  </filters>
  <formatters>
    <formatter name="xml" title="" officialProfileName="http://geonetwork.net/def/profile/raw-xml" contentType="application/xml"/>
    <formatter name="dcat-ap-nl-3" title="" officialProfileName="http://geonetwork.net/def/profile/dcat-ap-nl-3" contentType="application/rdf+xml"/>
    <formatter name="jsonld" title="" officialProfileName="http://geonetwork.net/def/profile/jsonld" contentType="application/json"/>
    <formatter name="iso19139" title="" officialProfileName="http://geonetwork.net/def/profile/iso19139" contentType="application/xml"/>
    <formatter name="iso19115-3.2018" title="" officialProfileName="http://geonetwork.net/def/profile/iso19115-3.2018" contentType="application/xml"/>
  </formatters>
</schema>
